{
  "id": "01J00000000000000000TURN01",
  "session_id": "01J0000000000000000SESSION",
  "turn_number": 1,
  "user_prompt": "Summarize the conformance vector suite.",
  "response_text": "The suite validates canonical Core objects against their schemas.",
  "model": "anthropic/claude-sonnet-4",
  "prompt_tokens": 42,
  "completion_tokens": 18,
  "total_tokens": 60,
  "iterations": 1,
  "duration_ms": 1200,
  "tools_used": [],
  "status": "completed",
  "created_at": "2026-07-28T00:00:00Z",
  "completed_at": "2026-07-28T00:00:02Z"
}
